{
  "version": "gatemole.verification_result.v0",
  "id": "verification:demo-001:tests",
  "transaction_id": "tx:demo-001",
  "name": "authentication-behavior",
  "kind": "invariant",
  "status": "passed",
  "effect_set_digest": "sha256:4444444444444444444444444444444444444444444444444444444444444444",
  "staged_state_digest": "sha256:5555555555555555555555555555555555555555555555555555555555555555",
  "verifier": {
    "id": "verifier:gatemole-tests",
    "kind": "service"
  },
  "independence": "platform_run",
  "verifier_digest": "sha256:6666666666666666666666666666666666666666666666666666666666666666",
  "inputs_digest": "sha256:7777777777777777777777777777777777777777777777777777777777777777",
  "evidence": [
    {
      "uri": "evidence://tx:demo-001/test-run",
      "digest": "sha256:8888888888888888888888888888888888888888888888888888888888888888",
      "media_type": "application/json"
    }
  ],
  "summary": "Authentication behavior remained unchanged.",
  "evaluated_at": "2026-07-23T08:03:00Z",
  "expires_at": "2026-07-23T09:03:00Z"
}
